{
  "$schema": "https://json-schema.org/draft/2020-12/schema",
  "$id": "ssa://layers/keys/cuisine.keys.schema.json",
  "title": "SSA Cuisine Keys Schema",
  "description": "Schema for cuisine.keys.json. Defines canonical key identifiers and field metadata used across SSA cuisine profiles, rulesets, rotations, and user preferences.",
  "type": "object",
  "additionalProperties": false,
  "required": ["keysetId", "version", "generatedAt", "notes", "enums", "keys"],
  "properties": {
    "$schema": {
      "type": "string",
      "description": "Optional schema pointer used by tooling/IDE validation."
    },
    "keysetId": {
      "type": "string",
      "minLength": 1,
      "pattern": "^[a-zA-Z0-9._-]+$",
      "description": "Stable identifier for this keyset (e.g., ssa.cuisine)."
    },
    "version": {
      "type": "string",
      "minLength": 1,
      "pattern": "^[0-9]+\\.[0-9]+\\.[0-9]+(-[a-zA-Z0-9._-]+)?$",
      "description": "Semantic version of this keyset."
    },
    "generatedAt": {
      "type": "string",
      "format": "date-time",
      "description": "ISO8601 timestamp when this file was generated."
    },
    "notes": {
      "type": "array",
      "description": "Human-readable notes for maintainers.",
      "items": { "type": "string" }
    },
    "enums": {
      "$ref": "#/$defs/enumsBlock"
    },
    "keys": {
      "type": "array",
      "minItems": 1,
      "items": { "$ref": "#/$defs/keyDef" },
      "description": "List of key definitions."
    }
  },
  "$defs": {
    "enumStringList": {
      "type": "array",
      "minItems": 1,
      "items": { "type": "string", "minLength": 1 }
    },

    "enumsBlock": {
      "type": "object",
      "additionalProperties": false,
      "required": [
        "entities",
        "domains",
        "valueTypes",
        "sensitivity",
        "lifecycle"
      ],
      "properties": {
        "entities": {
          "$ref": "#/$defs/enumStringList",
          "description": "Entity types for cuisine key definitions."
        },
        "domains": {
          "$ref": "#/$defs/enumStringList",
          "description": "Domains where keys are used (catalogs, meal_planning, shopping, etc.)."
        },
        "valueTypes": {
          "type": "array",
          "minItems": 1,
          "items": {
            "type": "string",
            "enum": ["string", "number", "boolean", "array", "object", "enum"]
          },
          "description": "Primitive/structural value types used by keys."
        },
        "sensitivity": {
          "$ref": "#/$defs/enumStringList",
          "description": "Sensitivity classification (public/internal/private)."
        },
        "lifecycle": {
          "$ref": "#/$defs/enumStringList",
          "description": "Lifecycle status values (active/deprecated)."
        },

        "heatLevels": {
          "$ref": "#/$defs/enumStringList",
          "description": "Allowed heat/spice intensity levels for cuisine preferences and recipes (e.g., none, mild, medium, hot, extra_hot)."
        },
        "prepDifficulty": {
          "$ref": "#/$defs/enumStringList",
          "description": "Allowed preparation difficulty levels (e.g., easy, moderate, advanced)."
        },
        "priority": {
          "$ref": "#/$defs/enumStringList",
          "description": "Allowed priority levels (e.g., low, normal, high, critical) used by planners/rotations."
        }
      }
    },

    "keyId": {
      "type": "string",
      "minLength": 1,
      "pattern": "^[a-zA-Z0-9_.-]+$",
      "description": "Canonical dotted key id (e.g., cuisine.profile.id)."
    },

    "entityName": {
      "type": "string",
      "minLength": 1,
      "pattern": "^[a-zA-Z0-9_.-]+$",
      "description": "Entity identifier (should match a value in enums.entities)."
    },

    "domainName": {
      "type": "string",
      "minLength": 1,
      "pattern": "^[a-zA-Z0-9_.-]+$",
      "description": "Domain identifier (should match a value in enums.domains)."
    },

    "valueType": {
      "type": "string",
      "enum": ["string", "number", "boolean", "array", "object", "enum"],
      "description": "Declared value type for the key."
    },

    "sensitivity": {
      "type": "string",
      "minLength": 1,
      "pattern": "^[a-zA-Z0-9_.-]+$"
    },

    "lifecycle": {
      "type": "string",
      "minLength": 1,
      "pattern": "^[a-zA-Z0-9_.-]+$"
    },

    "aliasesArray": {
      "type": "array",
      "description": "Alternate field names used by imports/scrapers/legacy systems.",
      "items": { "type": "string", "minLength": 1 },
      "default": []
    },

    "examplesArray": {
      "type": "array",
      "description": "Example values for the key; any JSON values allowed.",
      "items": {},
      "default": []
    },

    "keyDef": {
      "type": "object",
      "additionalProperties": false,
      "required": [
        "id",
        "label",
        "entity",
        "domain",
        "valueType",
        "description",
        "required",
        "aliases",
        "examples",
        "sensitivity",
        "lifecycle",
        "replacementId"
      ],
      "properties": {
        "id": { "$ref": "#/$defs/keyId" },
        "label": { "type": "string", "minLength": 1, "maxLength": 200 },
        "entity": { "$ref": "#/$defs/entityName" },
        "domain": { "$ref": "#/$defs/domainName" },
        "valueType": { "$ref": "#/$defs/valueType" },
        "description": { "type": "string", "default": "" },
        "required": { "type": "boolean" },
        "aliases": { "$ref": "#/$defs/aliasesArray" },
        "examples": { "$ref": "#/$defs/examplesArray" },
        "sensitivity": { "$ref": "#/$defs/sensitivity" },
        "lifecycle": { "$ref": "#/$defs/lifecycle" },
        "replacementId": {
          "description": "If lifecycle=deprecated, points to the new key id; otherwise null.",
          "anyOf": [{ "$ref": "#/$defs/keyId" }, { "type": "null" }]
        },

        "deprecatedAt": {
          "type": ["string", "null"],
          "format": "date-time",
          "description": "Optional timestamp for when the key was deprecated."
        },
        "sinceVersion": {
          "type": ["string", "null"],
          "pattern": "^[0-9]+\\.[0-9]+\\.[0-9]+(-[a-zA-Z0-9._-]+)?$",
          "description": "Optional: version when key was introduced."
        },
        "constraints": {
          "$ref": "#/$defs/constraints",
          "description": "Optional validation hints for downstream UI/importers."
        }
      }
    },

    "constraints": {
      "type": "object",
      "additionalProperties": false,
      "properties": {
        "min": { "type": "number" },
        "max": { "type": "number" },
        "minLength": { "type": "integer", "minimum": 0 },
        "maxLength": { "type": "integer", "minimum": 0 },
        "pattern": { "type": "string" },
        "enumValues": {
          "type": "array",
          "items": { "type": "string" },
          "description": "For valueType=enum, allowable values (optional)."
        },
        "itemType": {
          "type": "string",
          "enum": ["string", "number", "boolean", "object", "enum"],
          "description": "For valueType=array, hint for item type."
        },
        "uniqueItems": {
          "type": "boolean",
          "description": "For valueType=array, whether items should be unique."
        }
      }
    }
  }
}
