{
  "$schema": "./cuisine.keys.schema.json",
  "keysetId": "ssa.cuisine",
  "version": "1.0.0",
  "generatedAt": "2026-01-10T03:49:51Z",
  "notes": [
    "Cuisine Keys define canonical identifiers and field names used across SSA for cuisine profiles and user preferences.",
    "Use these keys to keep cuisines.catalog.json, plate_templates, substitutions, meal planning, and UI modules aligned.",
    "Keys are stable: do not rename ids; deprecate with replacementId when needed."
  ],
  "enums": {
    "domains": [
      "catalogs",
      "meal_planning",
      "cooking",
      "preferences",
      "ui",
      "analytics"
    ],
    "entities": [
      "cuisine",
      "profile",
      "preference",
      "override",
      "matrix",
      "rule"
    ],
    "valueTypes": [
      "string",
      "number",
      "boolean",
      "array",
      "object",
      "enum"
    ],
    "sensitivity": [
      "public",
      "internal",
      "private"
    ],
    "lifecycle": [
      "active",
      "deprecated"
    ],
    "heatLevels": [
      "none",
      "mild",
      "medium",
      "hot",
      "very_hot"
    ],
    "prepDifficulty": [
      "easy",
      "moderate",
      "advanced",
      "expert"
    ],
    "priority": [
      "low",
      "medium",
      "high",
      "critical"
    ]
  },
  "keys": [
    {
      "id": "cuisine.id",
      "label": "Cuisine ID",
      "domain": "catalogs",
      "entity": "cuisine",
      "valueType": "string",
      "description": "Stable cuisine identifier (e.g., cuisine.indian.north, cuisine.caribbean.jamaican).",
      "required": true,
      "aliases": [
        "id",
        "cuisineId"
      ],
      "examples": [
        "cuisine.indian.north"
      ],
      "sensitivity": "public",
      "lifecycle": "active",
      "replacementId": null
    },
    {
      "id": "cuisine.label",
      "label": "Cuisine Label",
      "domain": "catalogs",
      "entity": "cuisine",
      "valueType": "string",
      "description": "Human-friendly cuisine name.",
      "required": true,
      "aliases": [
        "name",
        "title"
      ],
      "examples": [
        "North Indian"
      ],
      "sensitivity": "public",
      "lifecycle": "active",
      "replacementId": null
    },
    {
      "id": "cuisine.description",
      "label": "Cuisine Description",
      "domain": "catalogs",
      "entity": "cuisine",
      "valueType": "string",
      "description": "Short description for UI/help.",
      "required": false,
      "aliases": [
        "desc"
      ],
      "examples": [
        "Curry-forward cuisine with aromatic spice bases."
      ],
      "sensitivity": "public",
      "lifecycle": "active",
      "replacementId": null
    },
    {
      "id": "cuisine.family",
      "label": "Cuisine Family",
      "domain": "catalogs",
      "entity": "cuisine",
      "valueType": "string",
      "description": "Optional cuisine family/cluster label.",
      "required": false,
      "aliases": [
        "cluster",
        "group"
      ],
      "examples": [
        "Indian"
      ],
      "sensitivity": "public",
      "lifecycle": "active",
      "replacementId": null
    },
    {
      "id": "cuisine.region",
      "label": "Cuisine Region",
      "domain": "catalogs",
      "entity": "cuisine",
      "valueType": "string",
      "description": "Region tag (South Asia, Caribbean, West Africa).",
      "required": false,
      "aliases": [
        "regionTag"
      ],
      "examples": [
        "South Asia"
      ],
      "sensitivity": "public",
      "lifecycle": "active",
      "replacementId": null
    },
    {
      "id": "cuisine.tags",
      "label": "Cuisine Tags",
      "domain": "catalogs",
      "entity": "cuisine",
      "valueType": "array",
      "description": "Tags for filtering/search and planner biases.",
      "required": false,
      "aliases": [
        "tagIds"
      ],
      "examples": [
        [
          "curry",
          "rice_based",
          "spice_forward"
        ]
      ],
      "sensitivity": "public",
      "lifecycle": "active",
      "replacementId": null
    },
    {
      "id": "cuisine.flavor.signature_spices",
      "label": "Signature Spices",
      "domain": "catalogs",
      "entity": "profile",
      "valueType": "array",
      "description": "List of signature spices.",
      "required": false,
      "aliases": [
        "signatureSpices"
      ],
      "examples": [
        [
          "cumin",
          "coriander",
          "turmeric"
        ]
      ],
      "sensitivity": "public",
      "lifecycle": "active",
      "replacementId": null
    },
    {
      "id": "cuisine.flavor.signature_herbs",
      "label": "Signature Herbs",
      "domain": "catalogs",
      "entity": "profile",
      "valueType": "array",
      "description": "List of signature herbs.",
      "required": false,
      "aliases": [
        "signatureHerbs"
      ],
      "examples": [
        [
          "cilantro",
          "mint"
        ]
      ],
      "sensitivity": "public",
      "lifecycle": "active",
      "replacementId": null
    },
    {
      "id": "cuisine.flavor.signature_aromatics",
      "label": "Signature Aromatics",
      "domain": "catalogs",
      "entity": "profile",
      "valueType": "array",
      "description": "Typical aromatics (onion, garlic, scallion, ginger).",
      "required": false,
      "aliases": [
        "signatureAromatics"
      ],
      "examples": [
        [
          "onion",
          "garlic",
          "ginger"
        ]
      ],
      "sensitivity": "public",
      "lifecycle": "active",
      "replacementId": null
    },
    {
      "id": "cuisine.flavor.signature_acids",
      "label": "Signature Acids",
      "domain": "catalogs",
      "entity": "profile",
      "valueType": "array",
      "description": "Acid sources (lime, vinegar, tamarind).",
      "required": false,
      "aliases": [
        "signatureAcids"
      ],
      "examples": [
        [
          "lime",
          "tamarind"
        ]
      ],
      "sensitivity": "public",
      "lifecycle": "active",
      "replacementId": null
    },
    {
      "id": "cuisine.flavor.signature_fats",
      "label": "Signature Fats",
      "domain": "catalogs",
      "entity": "profile",
      "valueType": "array",
      "description": "Fats (ghee, coconut oil).",
      "required": false,
      "aliases": [
        "signatureFats"
      ],
      "examples": [
        [
          "ghee",
          "mustard oil"
        ]
      ],
      "sensitivity": "public",
      "lifecycle": "active",
      "replacementId": null
    },
    {
      "id": "cuisine.flavor.signature_sweeteners",
      "label": "Signature Sweeteners",
      "domain": "catalogs",
      "entity": "profile",
      "valueType": "array",
      "description": "Sweeteners used (brown sugar, jaggery, honey).",
      "required": false,
      "aliases": [
        "signatureSweeteners"
      ],
      "examples": [
        [
          "jaggery"
        ]
      ],
      "sensitivity": "public",
      "lifecycle": "active",
      "replacementId": null
    },
    {
      "id": "cuisine.flavor.heat_level",
      "label": "Heat Level",
      "domain": "catalogs",
      "entity": "profile",
      "valueType": "enum",
      "description": "Overall heat level tag (none/mild/medium/hot/very_hot).",
      "required": false,
      "aliases": [
        "heatLevel"
      ],
      "examples": [
        "medium"
      ],
      "sensitivity": "public",
      "lifecycle": "active",
      "replacementId": null
    },
    {
      "id": "cuisine.flavor.axis.saltiness",
      "label": "Flavor Axis: saltiness",
      "domain": "catalogs",
      "entity": "matrix",
      "valueType": "number",
      "description": "Saltiness axis (0..1).",
      "required": false,
      "aliases": [
        "saltiness"
      ],
      "examples": [
        0.6
      ],
      "sensitivity": "internal",
      "lifecycle": "active",
      "replacementId": null
    },
    {
      "id": "cuisine.flavor.axis.sourness",
      "label": "Flavor Axis: sourness",
      "domain": "catalogs",
      "entity": "matrix",
      "valueType": "number",
      "description": "Sourness axis (0..1).",
      "required": false,
      "aliases": [
        "sourness"
      ],
      "examples": [
        0.6
      ],
      "sensitivity": "internal",
      "lifecycle": "active",
      "replacementId": null
    },
    {
      "id": "cuisine.flavor.axis.sweetness",
      "label": "Flavor Axis: sweetness",
      "domain": "catalogs",
      "entity": "matrix",
      "valueType": "number",
      "description": "Sweetness axis (0..1).",
      "required": false,
      "aliases": [
        "sweetness"
      ],
      "examples": [
        0.6
      ],
      "sensitivity": "internal",
      "lifecycle": "active",
      "replacementId": null
    },
    {
      "id": "cuisine.flavor.axis.bitterness",
      "label": "Flavor Axis: bitterness",
      "domain": "catalogs",
      "entity": "matrix",
      "valueType": "number",
      "description": "Bitterness axis (0..1).",
      "required": false,
      "aliases": [
        "bitterness"
      ],
      "examples": [
        0.6
      ],
      "sensitivity": "internal",
      "lifecycle": "active",
      "replacementId": null
    },
    {
      "id": "cuisine.flavor.axis.umami",
      "label": "Flavor Axis: umami",
      "domain": "catalogs",
      "entity": "matrix",
      "valueType": "number",
      "description": "Umami axis (0..1).",
      "required": false,
      "aliases": [
        "umami"
      ],
      "examples": [
        0.6
      ],
      "sensitivity": "internal",
      "lifecycle": "active",
      "replacementId": null
    },
    {
      "id": "cuisine.flavor.axis.smokiness",
      "label": "Flavor Axis: smokiness",
      "domain": "catalogs",
      "entity": "matrix",
      "valueType": "number",
      "description": "Smokiness axis (0..1).",
      "required": false,
      "aliases": [
        "smokiness"
      ],